{
  "$schema": "https://json-schema.org/draft/2020-12/schema",
  "type": "object",
  "required": [
    "_id",
    "_class",
    "cantidadProductos",
    "concepto",
    "emisor",
    "estatusPago",
    "fechaCreacion",
    "folio",
    "idCliente",
    "monto",
    "receptor"
  ],
  "properties": {
    "_id": {
      "$ref": "#/$defs/ObjectId"
    },
    "_class": {
      "type": "string"
    },
    "cantidadProductos": {
      "type": "integer"
    },
    "concepto": {
      "type": "string"
    },
    "emisor": {
      "type": "string"
    },
    "estatusPago": {
      "type": "string"
    },
    "fechaCreacion": {
      "$ref": "#/$defs/Date"
    },
    "folio": {
      "type": "string"
    },
    "idCliente": {
      "type": "string"
    },
    "monto": {
      "$ref": "#/$defs/Double"
    },
    "receptor": {
      "type": "string"
    }
  },
  "$defs": {
    "ObjectId": {
      "type": "object",
      "properties": {
        "$oid": {
          "type": "string",
          "pattern": "^[0-9a-fA-F]{24}$"
        }
      },
      "required": [
        "$oid"
      ],
      "additionalProperties": false
    },
    "Double": {
      "oneOf": [
        {
          "type": "number"
        },
        {
          "type": "object",
          "properties": {
            "$numberDouble": {
              "enum": [
                "Infinity",
                "-Infinity",
                "NaN"
              ]
            }
          }
        }
      ]
    },
    "Date": {
      "type": "object",
      "properties": {
        "$date": {
          "type": "string",
          "format": "date-time"
        }
      },
      "required": [
        "$date"
      ],
      "additionalProperties": false
    }
  }
}
